### ISSUE TITLE
CNI not working properly in ipv6 mode

### ISSUE THREAD

**Issue by amwat** [kubernetes-sigs/kind#1326]
**What happened**:
ref: https://github.com/kubernetes-sigs/kind/issues/1292#issue-555947266

**What you expected to happen**:
Ingress should work properly in ipv6.
**How to reproduce it (as minimally and precisely as possible)**:
Following the ingress-nginx guide on https://kind.sigs.k8s.io/docs/user/ingress/
with the addition of enabling ipv6
```yaml
kind: Cluster
apiVersion: kind.x-k8s.io/v1alpha4
networking:
  ipFamily: ipv6
nodes:
- role: control-plane
  kubeadmConfigPatches:
  - |
    kind: InitConfiguration
    nodeRegistration:
      kubeletExtraArgs:
        node-labels: "ingress-ready=true"
        authorization-mode: "AlwaysAllow"
  extraPortMappings:
  - containerPort: 80
    hostPort: 80
    protocol: TCP
  - containerPort: 443
    hostPort: 443
    protocol: TCP
```
**Anything else we need to know?**:
Note that the docker port forwarding seems to work correctly. 
example: just simply running nginx directly on the kind node is accessible from the host.
**Environment:**

- kind version: (use `kind version`): kind v0.8.0-alpha+7b4c4b691a7855 go1.13.7 linux/amd64
Kubernetes version: (use kubectl version): v1.17.0
Docker version: (use docker info): Docker version 19.03.5
OS (e.g. from /etc/os-release): Debian GNU/Linux

**Comment by BenTheElder** [comment]
FYI @aledbf -- pretty sure this is a KIND bug :+)

**Comment by aledbf** [comment]
I tested the configuration and cannot reach ingress-nginx using `::1` but it works if I used the IPV6 address assigned to the container.

**Comment by aojea** [comment]
it seems a bug in the docker proxy, that tries to use IPv4 on the translation when using `::1`as destination.

```
curl -v -6 -I ::1 localhost/foo
* Closing connection -1
curl: (3) URL using bad/illegal format or missing URL
*   Trying ::1:80...
* TCP_NODELAY set
* Connected to localhost (::1) port 80 (#0)
> HEAD /foo HTTP/1.1
> Host: localhost
> User-Agent: curl/7.68.0
> Accept: */*
> 
* Recv failure: Connection reset by peer
* Closing connection 0
curl: (56) Recv failure: Connection reset by peer
```

However, using the container IPv6 address it works as @aledbf says:

```
curl [2001:db8:1::242:ac11:3]/bar
bar
```

If we capture the traffic inside and outside of the containers we can check that the container only receives IPv4 traffic.

The capture outside of the node shows how the IPv6 TCP connection is established correctly, and then a new IPv4 TCP connection is initiated

```
13:44:12.233394 IP6 ::1.34076 > ::1.80: Flags [S], seq 562897345, win 65476, options [mss 65476,sackOK,TS val 406234100 ecr 0,nop,wscale 7], length 0
13:44:12.233421 IP6 ::1.80 > ::1.34076: Flags [S.], seq 865337600, ack 562897346, win 65464, options [mss 65476,sackOK,TS val 406234100 ecr 406234100,nop,wscale 7], length 0
13:44:12.233442 IP6 ::1.34076 > ::1.80: Flags [.], ack 1, win 512, options [nop,nop,TS val 406234100 ecr 406234100], length 0
```
TCP handshake OK

```
13:44:12.233552 IP6 ::1.34076 > ::1.80: Flags [P.], seq 1:78, ack 1, win 512, options [nop,nop,TS val 406234100 ecr 406234100], length 77: HTTP: HEAD /foo HTTP/1.1
13:44:12.233565 IP6 ::1.80 > ::1.34076: Flags [.], ack 78, win 511, options [nop,nop,TS val 406234100 ecr 406234100], length 0
```
Data Sent and ACK
```
13:44:12.233685 IP 172.17.0.1.36762 > 172.17.0.3.80: Flags [S], seq 3103350983, win 64240, options [mss 1460,sackOK,TS val 2826679012 ecr 0,nop,wscale 7], length 0
13:44:12.233698 IP 172.17.0.1.36762 > 172.17.0.3.80: Flags [S], seq 3103350983, win 64240, options [mss 1460,sackOK,TS val 2826679012 ecr 0,nop,wscale 7], length 0
13:44:12.233701 IP 172.17.0.1.36762 > 172.17.0.3.80: Flags [S], seq 3103350983, win 64240, options [mss 1460,sackOK,TS val 2826679012 ecr 0,nop,wscale 7], length 0
13:44:12.233731 IP 172.17.0.3.80 > 172.17.0.1.36762: Flags [R.], seq 0, ack 3103350984, win 0, length 0
13:44:12.233754 IP 172.17.0.3.80 > 172.17.0.1.36762: Flags [R.], seq 0, ack 1, win 0, length 0
```
TCP IPv4 connection that receives RESET because there is nothing listening on that port on IPv4

```
13:44:12.233865 IP6 ::1.80 > ::1.34076: Flags [R.], seq 1, ack 78, win 512, options [nop,nop,TS val 406234101 ecr 406234100], length 0
```
 
The IPv6 TCP connections receives a RESET too


Meanwhile, inside the container

```
root@kind-control-plane:/# tcpdump -ni any tcp port 80
tcpdump: verbose output suppressed, use -v or -vv for full protocol decode
listening on any, link-type LINUX_SLL (Linux cooked v1), capture size 262144 bytes

12:44:12.233706 IP 172.17.0.1.36762 > 172.17.0.3.80: Flags [S], seq 3103350983, win 64240, options [mss 1460,sackOK,TS val 2826679012 ecr 0,nop,wscale 7], length 0
12:44:12.233728 IP 172.17.0.3.80 > 172.17.0.1.36762: Flags [R.], seq 0, ack 3103350984, win 0, length 0
```
There is no IPv6 traffic received

If we use the container address instead `::1`we can see the IPv6 TCP traffic
```
root@kind-control-plane:/# tcpdump -ni any tcp port 80
tcpdump: verbose output suppressed, use -v or -vv for full protocol decode
listening on any, link-type LINUX_SLL (Linux cooked v1), capture size 262144 bytes
12:47:52.039550 IP6 2001:db8:1::1.48598 > 2001:db8:1::242:ac11:3.80: Flags [S], seq 3148568962, win 64800, options [mss 1440,sackOK,TS val 1349285822 ecr 0,nop,wscale 7], length 0
12:47:52.039649 IP6 2001:db8:1::1.48598 > fd00:10:244::6.80: Flags [S], seq 3148568962, win 64800, options [mss 1440,sackOK,TS val 1349285822 ecr 0,nop,wscale 7], length 0
```

will try to dig more into the docker proxy, I just found about it thanks to Ben in the xref issue

**Comment by aojea** [comment]
I think that the code of the docker-proxy supports ipv6 but if you take a look to the docker-proxy process you can see that is referring only to the IPv4 addresses, and the code seems to parse only the IPv4 address of the container

```
 2042 ?        Sl     0:00  \_ /usr/bin/docker-proxy -proto tcp -host-ip 0.0.0.0 -host-port 5000 -container-ip 172.17.0.2 -container-port 5000
18604 ?        Sl     0:00  \_ /usr/bin/docker-proxy -proto tcp -host-ip ::1 -host-port 32768 -container-ip 172.17.0.3 -container-port 6443
18610 ?        Sl     0:00  \_ /usr/bin/docker-proxy -proto tcp -host-ip :: -host-port 443 -container-ip 172.17.0.3 -container-port 443
18618 ?        Sl     0:00  \_ /usr/bin/docker-proxy -proto tcp -host-ip :: -host-port 80 -container-ip 172.17.0.3 -container-port 80
```

seems that there is some history behind this ... :thinking:  my understanding from the comments is that docker IPv6 is meant to be used without forwarding and adding public IPv6 addresses so the containers can be reached directly ... there are plenty of open issues but I think that the next one summarize it

https://github.com/moby/moby/issues/17666

**Comment by BenTheElder** [comment]
might need to at least document this in known issues. I'm out of bandwidth right now

**Comment by aojea** [comment]
I'll take care of this 👍

**Comment by BenTheElder** [comment]
this doesn't look like something that will be fixed upstream, I took a look through the history there ... we need to add a known issue entry I think

**Comment by aojea** [comment]
I totally forget sorry
